{
  "addresses": {
    "token": "0x22FE8fC0e8C596B70670886c5A29b208C0927182"
  },
  "ccip": {
    "chain_selector": "16015286601757825753",
    "registry_module_owner": "0xa3c796d480638d7476792230da1E2ADa86e031b0",
    "rmn_proxy": "0xba3f6251de62dED61Ff98590cB2fDf6871FbB991",
    "router": "0x0BF3dE8c5D3e8A2B34D2BEeB17ABfCeBaf363A59",
    "token_admin_registry": "0x95F29FEE11c5C55d26cCcf1DB6772DE953B37B82"
  },
  "ccv": {
    "message_id_verifier": "0x3Fc9b495EFA36Ee45B16bBC2cb62933d5C15eD08",
    "verifier_resolver": "0x2f1e2F615824338001E3CFB4B72a085c3f6A9581"
  },
  "chain": {
    "chain_id": 11155111,
    "chain_name": "sepolia",
    "pool_type": "SiloedLockRelease"
  },
  "deployed": {
    "advanced_pool_hooks": "0xF2C26F518B6983cc16CD7a0E8Fc884B783b39b85",
    "lock_boxes": [
      {
        "lock_box": "0x19ec97156B7Ba6cF2fc53F6Fb9eC66c68d37c26c",
        "remote_chain_name": "mantle_sepolia"
      }
    ],
    "pool_operation_manager": "0xB5b74Cb211Bb7a517a9c42c6984Db086A6b19223",
    "token_pool": "0xDAbAD808e35199d2f7Ac0a29f6386c462409add2"
  },
  "governance_addresses": {
    "chainlink_executors": [],
    "chainlink_mcms": "0x1D72FbCcfC86C88E23771d6D58a8F1Cb77186d1d",
    "emergency_brakes": "0x608056b8d596da5816146014E88DFfDECAF59DcD",
    "guardian": "0x608056b8d596da5816146014E88DFfDECAF59DcD",
    "lido_dao_agent": "0x300eE71099538fe97BF7dE281E8621E57Aa95DFA",
    "deployer": "0xE528a15071E6C5aF0C1ed8e6Ec647Ce9EC510597"
  },
  "remote_lanes": [
    {
      "is_siloed": true,
      "remote_chain_name": "mantle_sepolia"
    }
  ]
}