{
  "addresses": {
    "token": "0x6B49bb03b796d2e5c5114077A80d75E14cC26212"
  },
  "ccip": {
    "chain_selector": "8236463271206331221",
    "registry_module_owner": "0xf76cE612250eeEb8889F49FBCB11f1c2705305F6",
    "rmn_proxy": "0xcCB84Ec3F6AFdD2052134f74aaAc95Ae41A7B333",
    "router": "0xFd33fd627017fEf041445FC19a2B6521C9778f86",
    "token_admin_registry": "0x0F1eE88A582f31d92510E300fc1330AA5a525D51"
  },
  "ccv": {
    "message_id_verifier": "0x9B0b7B327009e2c2F89b1734f08205Db69079dD7",
    "verifier_resolver": "0x15Db1E4E28269e4e96825B851EE9Bd131193426e"
  },
  "chain": {
    "chain_id": 5003,
    "chain_name": "mantle_sepolia",
    "pool_type": "BurnMint"
  },
  "deployed": {
    "token_pool": "0xeaAdEA1794713403D3CDb0c72b4673EB66274FFd",
    "lock_boxes": [],
    "advanced_pool_hooks": "0xd016eFD2b48e9842e9c962C9D34EA62318C0822B",
    "pool_operation_manager": "0x834ec6E8DB4e77DFdB95C11ef63334D4340634BA"
  },
  "governance_addresses": {
    "chainlink_executors": [],
    "chainlink_mcms": "0x1D72FbCcfC86C88E23771d6D58a8F1Cb77186d1d",
    "emergency_brakes": "0x608056b8d596da5816146014E88DFfDECAF59DcD",
    "guardian": "0x608056b8d596da5816146014E88DFfDECAF59DcD",
    "lido_dao_agent": "0x37f8766ca78bD602AF2Af1E3bcC1265378f4762A",
    "deployer": "0xE528a15071E6C5aF0C1ed8e6Ec647Ce9EC510597"
  },
  "remote_lanes": [
    {
      "is_siloed": false,
      "remote_chain_name": "sepolia"
    }
  ]
}