{
  "addresses": {
    "token": "0xcc5Ba15FA275e5407d328861C56DDCedEd1250c8"
  },
  "ccip": {
    "chain_selector": "8236463271206331221",
    "registry_module_owner": "0xf76cE612250eeEb8889F49FBCB11f1c2705305F6",
    "rmn_proxy": "0xcCB84Ec3F6AFdD2052134f74aaAc95Ae41A7B333",
    "router": "0xFd33fd627017fEf041445FC19a2B6521C9778f86",
    "token_admin_registry": "0x0F1eE88A582f31d92510E300fc1330AA5a525D51"
  },
  "ccv": {
    "message_id_verifier": "0xfbAE3675db48b700dd7b0c9c21A147096780E862",
    "verifier_resolver": "0xBEcd653Bd319A0E3F3C23A19A67c3d3747D286ea"
  },
  "chain": {
    "chain_id": 5003,
    "chain_name": "mantle_sepolia",
    "pool_type": "BurnMint"
  },
  "deployed": {
    "lock_boxes": [],
    "advanced_pool_hooks": "0x3bE031BAC33897d92076cD02f1643a717EdF60A6",
    "token_pool": "0xeC7Cb3964EdcCa7B7925A7D159e033D1fC1DD0AB",
    "pool_operation_manager": "0x535618bb310546ca854f65D78332caf63cc8B124"
  },
  "governance_addresses": {
    "chainlink_executors": [],
    "chainlink_mcms": "0xE528a15071E6C5aF0C1ed8e6Ec647Ce9EC510597",
    "emergency_brakes": "0xE528a15071E6C5aF0C1ed8e6Ec647Ce9EC510597",
    "guardian": "0xE528a15071E6C5aF0C1ed8e6Ec647Ce9EC510597",
    "lido_dao_agent": "0xcC05f2eb27f592D3FFF3BCF40A1E86c015CDc7aB",
    "deployer": "0xE528a15071E6C5aF0C1ed8e6Ec647Ce9EC510597"
  },
  "remote_lanes": [
    {
      "is_siloed": false,
      "remote_chain_name": "sepolia"
    }
  ]
}
